{
  "defaults": {
    "owner_type": "ours",
    "branch": "main"
  },
  "org": "mertparlak-zima",
  "repos": [
    {
      "state_note": "artifacts/device-evidence (permanent acceptance evidence; never uploaded)",
      "stack": "Android/Kotlin offline dashcam, GPS and telemetry logger (Compose, Hilt, Room, CameraX, MapLibre)",
      "local_state": "irreplaceable",
      "product": "DriveTrace",
      "github": "https://github.com/mertparlak-zima/drive-trace.git",
      "skills_locations": [
        ".opencode/skills"
      ],
      "quirks": [
        "compose-outside-workspace",
        "runner-label-pending-migration",
        "mandatory-startup-set-overhead-faz-b",
        "external-worktree-d-development-drive-trace-worktrees"
      ],
      "defer_reason": null,
      "default_branch": "main",
      "path": "projects/drive-trace",
      "runner": {
        "label_status": "pending-migration",
        "compose": "D:\\development\\drive-trace\\docker-runner",
        "container": "dt-docker-1",
        "lifecycle": "keep-off-between-tasks",
        "label": "drive-trace"
      },
      "ci_workflows": [
        "ci.yml",
        "issue-governance.yml",
        "release-candidate.yml"
      ],
      "owner_type": "ours",
      "docs": {
        "agents": "AGENTS.md",
        "readme": "README.md",
        "key": [
          "docs/ROADMAP.md",
          "docs/architecture.md",
          "docs/data-model.md",
          "docs/data-integrity.md",
          "docs/device-test-runbook.md"
        ],
        "skills": "docs/agent-skills.md"
      },
      "deferred": false,
      "name": "drive-trace"
    },
    {
      "state_note": null,
      "stack": "TypeScript Gea Vite scaffold; Binance Futures paper-bot plan (Workers/D1 planned); Vitest; Node 24; self-hosted CI",
      "local_state": "clean",
      "product": "Coin Tracker",
      "github": "https://github.com/mertparlak-zima/coin-tracker.git",
      "skills_locations": [
        ".agents/skills"
      ],
      "quirks": [],
      "defer_reason": null,
      "default_branch": "main",
      "path": "projects/coin-tracker",
      "runner": {
        "label_status": "compliant",
        "compose": "infra/runner/compose.yml",
        "container": "ct-docker-1",
        "lifecycle": "leave-running",
        "label": "coin-tracker"
      },
      "ci_workflows": [
        "ci.yml"
      ],
      "owner_type": "ours",
      "docs": {
        "agents": "AGENTS.md",
        "readme": "README.md",
        "key": [
          "docs/product-plan.md",
          "docs/plan-review-2026-10-26.md",
          ".agents/skills/README.md",
          "docs/reset-2026-10-26.md"
        ],
        "skills": ".agents/skills/README.md"
      },
      "deferred": false,
      "name": "coin-tracker"
    },
    {
      "state_note": "private/ (AVD avd-8, keystores, personal build scripts) + .planning/ acceptance evidence; product Telegram configuration is separate from workspace notifications",
      "stack": "Android/Kotlin single full-screen WebView app with local cellular-call metadata collection (no audio); package dev.dailymoods.app",
      "local_state": "irreplaceable",
      "product": "Daily Moods",
      "github": "https://github.com/mertparlak-zima/call-tracker.git",
      "skills_locations": [
        "skills"
      ],
      "quirks": [
        "product-name-mismatch-daily-moods",
        "runner-label-migration-pending",
        "private-local-config"
      ],
      "defer_reason": null,
      "default_branch": "main",
      "path": "projects/call-tracker",
      "runner": {
        "label_status": "rename-pending-target-call-tracker",
        "compose": "infra/runner/compose.yml",
        "container": "dm-docker-1",
        "lifecycle": "stop-when-idle",
        "label": "daily-moods"
      },
      "ci_workflows": [
        "ci.yml"
      ],
      "owner_type": "ours",
      "docs": {
        "agents": "AGENTS.md",
        "readme": "README.md",
        "key": [
          "skills/daily-moods-workflow/SKILL.md"
        ],
        "skills": "skills/daily-moods-product/SKILL.md"
      },
      "deferred": false,
      "name": "call-tracker"
    },
    {
      "state_note": null,
      "stack": "Python tooling for LG 42LB652V-ZA (webOS 1.4) GlobalClone TLL satellite channel lists (Turksat 42E), USB export/import",
      "local_state": "clean",
      "product": "LG Channel List Editor",
      "github": "https://github.com/mertparlak-zima/lg-channel-import.git",
      "skills_locations": [
        ".claude/skills"
      ],
      "quirks": [
        "github-name-mismatch-lg-channel-import"
      ],
      "defer_reason": null,
      "default_branch": "main",
      "path": "projects/lg-tv-channel-sort",
      "runner": {
        "label_status": "compliant",
        "compose": "infra/runner/compose.yml",
        "container": "lg-tv-channel-sort-docker-1",
        "lifecycle": "stop-when-idle",
        "label": "lg-tv-channel-sort"
      },
      "ci_workflows": [
        "ci.yml"
      ],
      "owner_type": "ours",
      "docs": {
        "agents": "AGENTS.md",
        "readme": "README.md",
        "key": [
          ".claude/skills/lg-42lb652v-tv/SKILL.md",
          "scripts/verify_channel_list.py"
        ],
        "skills": ".claude/skills/lg-tll-channel-editing/SKILL.md"
      },
      "deferred": false,
      "name": "lg-tv-channel-sort"
    },
    {
      "state_note": "input/, output/, samples/ and root .srt files are local-only irreplaceable media (never committed)",
      "stack": "Python Turkish subtitle toolkit: encoding repair (fix_srt.py), re-sync vs reference (resync_srt.py), PGS OCR extraction (extract_pgs.py)",
      "local_state": "irreplaceable",
      "product": "str-fixer",
      "github": "https://github.com/mertparlak-zima/str-fixer.git",
      "skills_locations": [
        ".claude/skills"
      ],
      "quirks": [
        "media-files-never-committed"
      ],
      "defer_reason": null,
      "default_branch": "main",
      "path": "projects/str-fixer",
      "runner": {
        "label_status": "compliant",
        "compose": "infra/runner/compose.yml",
        "container": "str-fixer-docker-1",
        "lifecycle": "stop-when-idle",
        "label": "str-fixer"
      },
      "ci_workflows": [
        "ci.yml"
      ],
      "owner_type": "ours",
      "docs": {
        "agents": "AGENTS.md",
        "readme": "README.md",
        "key": [
          ".claude/skills/srt-resync/SKILL.md",
          ".claude/skills/pgs-extract/SKILL.md",
          "scripts/fix_srt.py",
          "scripts/resync_srt.py",
          "scripts/extract_pgs.py",
          "scripts/selftest_suite.py"
        ],
        "skills": ".claude/skills/srt-fixing/SKILL.md"
      },
      "deferred": false,
      "name": "str-fixer"
    },
    {
      "github": "https://github.com/mertparlak-zima/tahmin-ligi.git",
      "skills_locations": [
        ".agents/skills"
      ],
      "owner_type": "ours",
      "path": "projects/tahmin-ligi",
      "runner": {
        "label_status": "compliant",
        "compose": "infra/runner/compose.yml",
        "container": "tahmin-ligi-docker-1",
        "lifecycle": "stop-when-idle",
        "label": "tahmin-ligi"
      },
      "name": "tahmin-ligi",
      "state_note": "backups/ contains local Supabase data snapshots; product .env/.env.local and .vercel linkage remain local",
      "ci_workflows": [
        "ci.yml"
      ],
      "quirks": [
        "vercel-deployment",
        "local-db-backups",
        "product-env-required-for-live-db"
      ],
      "stack": "Gea TypeScript Vite SPA, Vercel serverless, Supabase Postgres, ESPN fixtures",
      "docs": {
        "readme": "README.md",
        "agents": "AGENTS.md",
        "skills": ".agents/skills/gea-framework/SKILL.md",
        "key": [
          "docs/gea-upstream-bugs.md"
        ]
      },
      "local_state": "irreplaceable",
      "product": "Tahmin Ligi",
      "default_branch": "main"
    },
    {
      "github": "https://github.com/mertparlak-zima/heliboard-archive.git",
      "skills_locations": [],
      "owner_type": "ours",
      "path": "projects/heliboard-archive",
      "runner": {
        "label_status": "compliant",
        "compose": "infra/runner/compose.yml",
        "container": "heliboard-archive-docker-1",
        "lifecycle": "stop-when-idle",
        "label": "heliboard-archive"
      },
      "name": "heliboard-archive",
      "state_note": "P04-P20 merged (PRs #30-#47): full local feature set through the device E2E matrix (ADR-016); personal-use scope (minSdk 31, no store); P21 performance + P22 signed APK remain to first release; P23-P25 cloud open (Supabase leaning).",
      "ci_workflows": [
        "ci.yml"
      ],
      "quirks": [
        "upstream-heliboard-fork",
        "archive-implementation-in-progress"
      ],
      "stack": "Android Kotlin Java HeliBoard fork with offline personal text archive",
      "docs": {
        "readme": "README.md",
        "agents": "AGENTS.md",
        "skills": null,
        "key": [
          "docs/README.md",
          "docs/roadmap.md"
        ]
      },
      "local_state": "clean",
      "product": "HeliBoard Archive",
      "default_branch": "main"
    }
  ],
  "third_party": [],
  "version": 1
}
